{
  "schema_version": "1flowbase.model-pricing-search/v2",
  "catalog_version": "2026-10-31.5",
  "generated_at": "2026-10-31T07:42:19.947Z",
  "source_fingerprint": "sha256:669a767e3a53353536832b75fe2c89f240aa8d98ce03c2707c5abbb693af14a6",
  "entries": [
    {
      "id": "173d57ee-df6e-494b-93f3-4d5de817e39a",
      "provider_code": "302ai",
      "upstream_model_id": "minimax-m3",
      "effective_from": "2026-10-31T02:01:38.612Z",
      "effective_to": null,
      "priority": 0,
      "enabled": true,
      "catalog_page": {
        "page": 1,
        "cursor": "start",
        "checksum": "sha256:c152695c639b29ec986ba2c248461848f9f9a0809be85159db37f647e152f5d5",
        "locator": "https://raw.githubusercontent.com/taichuy/1flowbase-official-plugins/main/model-pricing/catalog/v1/pages/1.json"
      }
    },
    {
      "id": "bb2ae6a3-9bd6-48a4-bbdb-92c77309397b",
      "provider_code": "302ai",
      "upstream_model_id": "claude-fable-5",
      "effective_from": "2026-10-31T02:01:38.612Z",
      "effective_to": null,
      "priority": 0,
      "enabled": true,
      "catalog_page": {
        "page": 1,
        "cursor": "start",
        "checksum": "sha256:c152695c639b29ec986ba2c248461848f9f9a0809be85159db37f647e152f5d5",
        "locator": "https://raw.githubusercontent.com/taichuy/1flowbase-official-plugins/main/model-pricing/catalog/v1/pages/1.json"
      }
    },
    {
      "id": "e1a67162-739e-4ec8-be65-03b10d1daa68",
      "provider_code": "302ai",
      "upstream_model_id": "claude-fable-5-1",
      "effective_from": "2026-10-31T02:01:38.612Z",
      "effective_to": null,
      "priority": 0,
      "enabled": true,
      "catalog_page": {
        "page": 1,
        "cursor": "start",
        "checksum": "sha256:c152695c639b29ec986ba2c248461848f9f9a0809be85159db37f647e152f5d5",
        "locator": "https://raw.githubusercontent.com/taichuy/1flowbase-official-plugins/main/model-pricing/catalog/v1/pages/1.json"
      }
    },
    {
      "id": "5d29b102-6312-44d4-b603-b8fd7ca4ea9e",
      "provider_code": "302ai",
      "upstream_model_id": "claude-haiku-5-5",
      "effective_from": "2026-10-31T02:01:38.612Z",
      "effective_to": null,
      "priority": 0,
      "enabled": true,
      "catalog_page": {
        "page": 1,
        "cursor": "start",
        "checksum": "sha256:c152695c639b29ec986ba2c248461848f9f9a0809be85159db37f647e152f5d5",
        "locator": "https://raw.githubusercontent.com/taichuy/1flowbase-official-plugins/main/model-pricing/catalog/v1/pages/1.json"
      }
    },
    {
      "id": "04556997-81fc-4a40-8c1f-83efa57ef00b",
      "provider_code": "302ai",
      "upstream_model_id": "claude-opus-4-1-20250805",
      "effective_from": "2026-10-31T02:01:38.612Z",
      "effective_to": null,
      "priority": 0,
      "enabled": true,
      "catalog_page": {
        "page": 1,
        "cursor": "start",
        "checksum": "sha256:c152695c639b29ec986ba2c248461848f9f9a0809be85159db37f647e152f5d5",
        "locator": "https://raw.githubusercontent.com/taichuy/1flowbase-official-plugins/main/model-pricing/catalog/v1/pages/1.json"
      }
    },
    {
      "id": "478afeb6-fe6a-4a9e-9350-a28230380087",
      "provider_code": "302ai",
      "upstream_model_id": "claude-opus-4-7",
      "effective_from": "2026-10-31T02:01:38.612Z",
      "effective_to": null,
      "priority": 0,
      "enabled": true,
      "catalog_page": {
        "page": 1,
        "cursor": "start",
        "checksum": "sha256:c152695c639b29ec986ba2c248461848f9f9a0809be85159db37f647e152f5d5",
        "locator": "https://raw.githubusercontent.com/taichuy/1flowbase-official-plugins/main/model-pricing/catalog/v1/pages/1.json"
      }
    },
    {
      "id": "8f2abaea-c3ec-4fcd-bbdc-42e4f5fa8238",
      "provider_code": "302ai",
      "upstream_model_id": "claude-opus-4-8",
      "effective_from": "2026-10-31T02:01:38.612Z",
      "effective_to": null,
      "priority": 0,
      "enabled": true,
      "catalog_page": {
        "page": 1,
        "cursor": "start",
        "checksum": "sha256:c152695c639b29ec986ba2c248461848f9f9a0809be85159db37f647e152f5d5",
        "locator": "https://raw.githubusercontent.com/taichuy/1flowbase-official-plugins/main/model-pricing/catalog/v1/pages/1.json"
      }
    },
    {
      "id": "55a9911a-43e6-4afd-b574-e58f21596d47",
      "provider_code": "302ai",
      "upstream_model_id": "claude-opus-5",
      "effective_from": "2026-10-31T02:01:38.612Z",
      "effective_to": null,
      "priority": 0,
      "enabled": true,
      "catalog_page": {
        "page": 1,
        "cursor": "start",
        "checksum": "sha256:c152695c639b29ec986ba2c248461848f9f9a0809be85159db37f647e152f5d5",
        "locator": "https://raw.githubusercontent.com/taichuy/1flowbase-official-plugins/main/model-pricing/catalog/v1/pages/1.json"
      }
    },
    {
      "id": "d5847ffb-6deb-47cf-819f-6f4af8f34e8a",
      "provider_code": "302ai",
      "upstream_model_id": "claude-opus-5-5",
      "effective_from": "2026-10-31T02:01:38.612Z",
      "effective_to": null,
      "priority": 0,
      "enabled": true,
      "catalog_page": {
        "page": 1,
        "cursor": "start",
        "checksum": "sha256:c152695c639b29ec986ba2c248461848f9f9a0809be85159db37f647e152f5d5",
        "locator": "https://raw.githubusercontent.com/taichuy/1flowbase-official-plugins/main/model-pricing/catalog/v1/pages/1.json"
      }
    },
    {
      "id": "0e94dfc3-f066-4f21-9616-1749ee8113bf",
      "provider_code": "302ai",
      "upstream_model_id": "claude-opus-5-thinking",
      "effective_from": "2026-10-31T02:01:38.612Z",
      "effective_to": null,
      "priority": 0,
      "enabled": true,
      "catalog_page": {
        "page": 1,
        "cursor": "start",
        "checksum": "sha256:c152695c639b29ec986ba2c248461848f9f9a0809be85159db37f647e152f5d5",
        "locator": "https://raw.githubusercontent.com/taichuy/1flowbase-official-plugins/main/model-pricing/catalog/v1/pages/1.json"
      }
    },
    {
      "id": "7b4a9bcf-7a43-4c4e-96e4-2ff86cdd6962",
      "provider_code": "302ai",
      "upstream_model_id": "claude-sonnet-4-5-20250929",
      "effective_from": "2026-10-31T02:01:38.612Z",
      "effective_to": null,
      "priority": 0,
      "enabled": true,
      "catalog_page": {
        "page": 1,
        "cursor": "start",
        "checksum": "sha256:c152695c639b29ec986ba2c248461848f9f9a0809be85159db37f647e152f5d5",
        "locator": "https://raw.githubusercontent.com/taichuy/1flowbase-official-plugins/main/model-pricing/catalog/v1/pages/1.json"
      }
    },
    {
      "id": "40a0373e-508c-4bab-9923-37240067cc60",
      "provider_code": "302ai",
      "upstream_model_id": "claude-sonnet-4-5-20250929-thinking",
      "effective_from": "2026-10-31T02:01:38.612Z",
      "effective_to": null,
      "priority": 0,
      "enabled": true,
      "catalog_page": {
        "page": 1,
        "cursor": "start",
        "checksum": "sha256:c152695c639b29ec986ba2c248461848f9f9a0809be85159db37f647e152f5d5",
        "locator": "https://raw.githubusercontent.com/taichuy/1flowbase-official-plugins/main/model-pricing/catalog/v1/pages/1.json"
      }
    },
    {
      "id": "67c1daa6-5728-43f1-8213-dd16a2165e25",
      "provider_code": "302ai",
      "upstream_model_id": "claude-sonnet-4-6",
      "effective_from": "2026-10-31T02:01:38.612Z",
      "effective_to": null,
      "priority": 0,
      "enabled": true,
      "catalog_page": {
        "page": 1,
        "cursor": "start",
        "checksum": "sha256:c152695c639b29ec986ba2c248461848f9f9a0809be85159db37f647e152f5d5",
        "locator": "https://raw.githubusercontent.com/taichuy/1flowbase-official-plugins/main/model-pricing/catalog/v1/pages/1.json"
      }
    },
    {
      "id": "7383593c-4a5d-4488-9545-4bb1e4c1059d",
      "provider_code": "302ai",
      "upstream_model_id": "claude-sonnet-4-6-thinking",
      "effective_from": "2026-10-31T02:01:38.612Z",
      "effective_to": null,
      "priority": 0,
      "enabled": true,
      "catalog_page": {
        "page": 1,
        "cursor": "start",
        "checksum": "sha256:c152695c639b29ec986ba2c248461848f9f9a0809be85159db37f647e152f5d5",
        "locator": "https://raw.githubusercontent.com/taichuy/1flowbase-official-plugins/main/model-pricing/catalog/v1/pages/1.json"
      }
    },
    {
      "id": "dc17064e-cbf4-4522-b8bf-f13ac3ff6d95",
      "provider_code": "302ai",
      "upstream_model_id": "claude-sonnet-5",
      "effective_from": "2026-10-31T02:01:38.612Z",
      "effective_to": null,
      "priority": 0,
      "enabled": true,
      "catalog_page": {
        "page": 1,
        "cursor": "start",
        "checksum": "sha256:c152695c639b29ec986ba2c248461848f9f9a0809be85159db37f647e152f5d5",
        "locator": "https://raw.githubusercontent.com/taichuy/1flowbase-official-plugins/main/model-pricing/catalog/v1/pages/1.json"
      }
    },
    {
      "id": "8d4f30d8-7756-43e6-86de-6162cd00e3a4",
      "provider_code": "302ai",
      "upstream_model_id": "claude-sonnet-5-5",
      "effective_from": "2026-10-31T02:01:38.612Z",
      "effective_to": null,
      "priority": 0,
      "enabled": true,
      "catalog_page": {
        "page": 1,
        "cursor": "start",
        "checksum": "sha256:c152695c639b29ec986ba2c248461848f9f9a0809be85159db37f647e152f5d5",
        "locator": "https://raw.githubusercontent.com/taichuy/1flowbase-official-plugins/main/model-pricing/catalog/v1/pages/1.json"
      }
    },
    {
      "id": "471f933b-b175-492b-aee8-129fad0cb920",
      "provider_code": "302ai",
      "upstream_model_id": "gemini-4-argon",
      "effective_from": "2026-10-31T02:01:38.612Z",
      "effective_to": null,
      "priority": 0,
      "enabled": true,
      "catalog_page": {
        "page": 1,
        "cursor": "start",
        "checksum": "sha256:c152695c639b29ec986ba2c248461848f9f9a0809be85159db37f647e152f5d5",